{"adapterContractVersion":1,"envelopeDigest":"sha256:ec8aa840f0beca172f88a6ca225d15715ac4efd139f8fde7227baf9204f11b34","format":"agent-teams.repository-mutation.transaction-envelope/v1","kernelArtifact":{"buildIdentity":"sha256:1111111111111111111111111111111111111111111111111111111111111111","name":"@agent-teams/repository-mutation","version":"0.0.0"},"operationKind":"known-file-transaction","ownerArtifact":{"buildIdentity":"sha256:1111111111111111111111111111111111111111111111111111111111111111","name":"@agent-teams/repository-mutation","version":"0.0.0"},"payload":{"authorizedDirectories":[],"createdDirectories":[],"operations":[{"path":"managed","state":"pending"},{"path":"managed-other","state":"pending"},{"path":"managed/child.txt","state":"pending"}],"plan":{"operations":[{"path":"managed","postimage":{"contentBase64":"bWFuYWdlZAo=","digest":"sha256:5b4bc29f140e30c01417d810e700ecc54a84a0107566d84215b42e5742ef8d96","mode":420,"size":8},"precondition":{"state":"absent"}},{"path":"managed-other","postimage":{"contentBase64":"b3RoZXIK","digest":"sha256:7e4fa2eb8c7ac089739d5defc4489fad68a100d92082ca35c6b40a4524821f87","mode":420,"size":6},"precondition":{"state":"absent"}},{"path":"managed/child.txt","postimage":{"contentBase64":"Y2hpbGQK","digest":"sha256:2fa14f53e6b15cac9ac77846c7be87862c2a7e9ec0c6cea319db939317f126ed","mode":420,"size":6},"precondition":{"state":"absent"}}],"planDigest":"sha256:03f1458c3ceddf585ebeb8696c2180df098c1e0a3f15f42d11001c1ae06def66","protocol":"agent-teams.repository-mutation.known-file/v1","schemaVersion":1},"schemaVersion":1},"payloadDigest":"sha256:f122a6a24ea057643bbcbc3275ee192f1f2a59b5ea2916428f95a94c03cbf2e3","payloadKind":"agent-teams.repository-mutation.known-file-journal/v1","recoveryHandler":{"contractVersion":1,"id":"agent-teams.repository-mutation.known-file/v1"},"schemaVersion":6,"state":"APPLYING"}
