{"adapterContractVersion":1,"envelopeDigest":"sha256:43d2d9ac1875b007510ff0fb3f89fcab64f1d4642f56a15c15836f07fd451d45","format":"agent-teams.repository-mutation.transaction-envelope/v1","kernelArtifact":{"buildIdentity":"sha256:1111111111111111111111111111111111111111111111111111111111111111","name":"@agent-teams/repository-mutation","version":"0.0.0"},"operationKind":"known-file-transaction","ownerArtifact":{"buildIdentity":"sha256:1111111111111111111111111111111111111111111111111111111111111111","name":"@agent-teams/repository-mutation","version":"0.0.0"},"payload":{"authorizedDirectories":[],"createdDirectories":[],"operations":[{"path":"managed/a.txt","state":"pending"},{"path":"managed/b.txt","state":"pending"}],"plan":{"operations":[{"path":"managed/a.txt","postimage":{"contentBase64":"YQo=","digest":"sha256:87428fc522803d31065e7bce3cf03fe475096631e5e07bbd7a0fde60c4cf25c7","mode":420,"size":2},"precondition":{"state":"absent"}},{"path":"managed/b.txt","postimage":{"contentBase64":"Ygo=","digest":"sha256:0263829989b6fd954f72baaf2fc64bc2e2f01d692d4de72986ea808f6e99813f","mode":420,"size":2},"precondition":{"state":"absent"}}],"planDigest":"sha256:7709e59fd1f91d75f5a170fc0c266a86237f869dc3ab124bf7e5309aa4c64910","protocol":"agent-teams.repository-mutation.known-file/v1","schemaVersion":1},"schemaVersion":1},"payloadDigest":"sha256:cf218517991cc6d09261407e9f61d21a6dac07cb9c881c529d2042298cdd1eed","payloadKind":"agent-teams.repository-mutation.known-file-journal/v1","recoveryHandler":{"contractVersion":1,"id":"agent-teams.repository-mutation.known-file/v1"},"schemaVersion":6,"state":"APPLYING"}
